[
  {
    "description": "authentik is an IdP (Identity Provider) and SSO (Single Sign On) platform that is built with security at the forefront of every piece of code, every feature, with an emphasis on flexibility and versatility",
    "docker_hub_url": "https://hub.docker.com/r/authentik/server",
    "dockerfile_url": "https://github.com/goauthentik/authentik/blob/main/lifecycle/container/Dockerfile",
    "local_url": "https://authentik.services.local",
    "name": "authentik",
    "url": "https://goauthentik.io/"
  },
  {
    "description": "Analyzes resource usage and performance characteristics of running containers",
    "docker_hub_url": "https://hub.docker.com/r/google/cadvisor",
    "dockerfile_url": "https://github.com/google/cadvisor/blob/master/deploy/Dockerfile",
    "local_url": "https://cadvisor.services.local",
    "name": "cAdvisor",
    "url": "https://github.com/google/cadvisor"
  },
  {
    "description": "A highly customizable homepage (or startpage / application dashboard) with Docker and service API integrations",
    "docker_hub_url": "https://hub.docker.com/r/gethomepage/homepage",
    "dockerfile_url": "https://github.com/gethomepage/homepage/blob/dev/Dockerfile",
    "local_url": "https://homepage.services.local",
    "name": "homepage",
    "url": "https://gethomepage.dev"
  },
  {
    "description": "Collection of handy online tools for developers, with great UX",
    "docker_hub_url": "https://hub.docker.com/r/corentinth/it-tools",
    "dockerfile_url": "https://github.com/CorentinTh/it-tools/blob/main/Dockerfile",
    "local_url": "https://it-tools.services.local",
    "name": "IT - TOOLS",
    "url": "https://it-tools.tech"
  },
  {
    "description": "An email and SMTP testing tool with API for developers",
    "docker_hub_url": "https://hub.docker.com/r/axllent/mailpit",
    "dockerfile_url": "https://github.com/axllent/mailpit/blob/master/Dockerfile",
    "local_url": "https://mailpit.services.local",
    "name": "Mailpit",
    "url": "https://mailpit.axllent.org"
  },
  {
    "description": "Mealie is an intuitive and easy to use recipe management app",
    "docker_hub_url": "https://github.com/mealie-recipes/mealie/pkgs/container/mealie",
    "dockerfile_url": "https://github.com/mealie-recipes/mealie/blob/mealie-next/docker/Dockerfile",
    "local_url": "https://mealie.services.local",
    "name": "Mealie",
    "url": "https://mealie.io/"
  },
  {
    "description": "MinIO is a high-performance, S3 compatible object store, open sourced under GNU AGPLv3 license",
    "docker_hub_url": "https://hub.docker.com/r/minio/minio",
    "dockerfile_url": "https://github.com/minio/minio/blob/master/Dockerfile",
    "local_url": "https://minio.services.local",
    "name": "MinIO",
    "url": "https://min.io"
  },
  {
    "dependents": [
      {
        "description": "Web-based MongoDB admin interface, written with Node.js and Express",
        "docker_hub_url": "https://hub.docker.com/_/mongo-express",
        "dockerfile_url": "https://github.com/mongo-express/mongo-express/blob/master/Dockerfile",
        "local_url": "https://mongo-express.services.local",
        "name": "mongo-express",
        "url": "https://github.com/mongo-express/mongo-express"
      },
      {
        "description": "A Prometheus exporter for MongoDB including sharding, replication and storage engines",
        "docker_hub_url": "hhttps://hub.docker.com/r/percona/mongodb_exporter",
        "dockerfile_url": "https://github.com/percona/mongodb_exporter/blob/main/Dockerfile",
        "local_url": null,
        "name": "MongoDB exporter",
        "url": "https://github.com/percona/mongodb_exporter"
      }
    ],
    "description": "MongoDB is a document database with the scalability and flexibility that you want with the querying and indexing that you need",
    "docker_hub_url": "https://hub.docker.com/_/mongo",
    "dockerfile_url": "https://github.com/docker-library/mongo/blob/master/8.0/Dockerfile",
    "local_url": null,
    "name": "MongoDB",
    "url": "https://www.mongodb.com"
  },
  {
    "dependents": [
      {
        "description": "A web interface for MySQL and MariaDB",
        "docker_hub_url": "https://hub.docker.com/_/phpmyadmin",
        "dockerfile_url": "https://github.com/phpmyadmin/docker/blob/master/apache/Dockerfile",
        "local_url": "https://phpmyadmin.services.local",
        "name": "phpMyAdmin",
        "url": "https://www.phpmyadmin.net"
      },
      {
        "description": "A Exporter for MySQL server metrics",
        "docker_hub_url": "https://hub.docker.com/r/prom/mysqld-exporter",
        "dockerfile_url": "https://github.com/prometheus/mysqld_exporter/blob/main/Dockerfile",
        "local_url": null,
        "name": "MySQL Server Exporter",
        "url": "https://github.com/prometheus/mysqld_exporter"
      }
    ],
    "description": "MySQL is the world's most popular open source database",
    "docker_hub_url": "https://hub.docker.com/_/mysql",
    "dockerfile_url": "https://github.com/docker-library/mysql/blob/master/innovation/Dockerfile.oracle",
    "local_url": null,
    "name": "MySQL",
    "url": "https://www.mysql.com"
  },
  {
    "dependents": [
      {
        "description": "Open WebUI is an extensible, self-hosted AI interface that adapts to your workflow, all while operating entirely offline",
        "docker_hub_url": "https://github.com/open-webui/open-webui/pkgs/container/open-webui",
        "dockerfile_url": "https://github.com/open-webui/open-webui/blob/main/Dockerfile",
        "local_url": "https://open-webui.services.local",
        "name": "Open WebUI",
        "url": "https://openwebui.com/"
      }
    ],
    "description": "Chat & build with open models",
    "docker_hub_url": "https://hub.docker.com/r/ollama/ollama",
    "dockerfile_url": "https://github.com/ollama/ollama/blob/main/Dockerfile",
    "local_url": null,
    "name": "Ollama",
    "url": "https://ollama.com/"
  },
  {
    "description": "Self-hosted collection of powerful web-based tools for everyday tasks. No ads, no tracking, just fast, accessible utilities right from your browser!",
    "docker_hub_url": "https://hub.docker.com/r/iib0011/omni-tools",
    "dockerfile_url": "https://github.com/iib0011/omni-tools/blob/main/Dockerfile",
    "local_url": "https://omni-tools.services.local",
    "name": "Omni Tools",
    "url": "https://omnitools.app"
  },
  {
    "dependents": [
      {
        "description": "pgAdmin is the most popular and feature rich Open Source administration and development platform for PostgreSQL, the most advanced Open Source database in the world",
        "docker_hub_url": "https://hub.docker.com/r/dpage/pgadmin4",
        "dockerfile_url": "https://github.com/pgadmin-org/pgadmin4/blob/master/Dockerfile",
        "local_url": "https://pgadmin4.services.local",
        "name": "pgadmin4",
        "url": "https://www.pgadmin.org"
      },
      {
        "description": "A PostgreSQL metric exporter for Prometheus",
        "docker_hub_url": "https://hub.docker.com/r/prometheuscommunity/postgres-exporter",
        "dockerfile_url": "https://github.com/prometheus-community/postgres_exporter/blob/master/Dockerfile",
        "local_url": null,
        "name": "PostgreSQL Server Exporter",
        "url": "https://github.com/prometheus-community/postgres_exporter"
      }
    ],
    "description": "PostgreSQL is a powerful, open source object-relational database system with over 35 years of active development that has earned it a strong reputation for reliability, feature robustness, and performance",
    "docker_hub_url": "https://hub.docker.com/_/postgres",
    "dockerfile_url": "https://github.com/docker-library/postgres/blob/master/17/bookworm/Dockerfile",
    "local_url": null,
    "name": "PostgreSQL",
    "url": "https://www.postgresql.org"
  },
  {
    "description": "Monitor your applications, systems, and services with the leading open source monitoring solution. Instrument, collect, store, and query your metrics for alerting, dashboarding, and other use cases",
    "docker_hub_url": "https://hub.docker.com/r/prom/prometheus",
    "dockerfile_url": "https://github.com/prometheus/prometheus/blob/main/Dockerfile",
    "local_url": "https://prometheus.services.local",
    "name": "prometheus",
    "url": "https://prometheus.io/"
  },
  {
    "description": "RabbitMQ is a reliable and mature messaging and streaming broker, which is easy to deploy on cloud environments, on-premises, and on your local machine. It is currently used by millions worldwide",
    "docker_hub_url": "https://hub.docker.com/_/rabbitmq",
    "dockerfile_url": "https://github.com/docker-library/rabbitmq/blob/master/4.0/alpine/Dockerfile",
    "local_url": "https://rabbitmq.services.local",
    "name": "RabbitMQ",
    "url": "https://www.rabbitmq.com"
  },
  {
    "dependents": [
      {
        "description": "Redis GUI by Redis",
        "docker_hub_url": "https://hub.docker.com/r/redis/redisinsight",
        "dockerfile_url": "https://github.com/RedisInsight/RedisInsight/blob/main/Dockerfile",
        "local_url": "https://redisinsight.services.local",
        "name": "Redis Insight",
        "url": "https://redis.io/insight"
      }
    ],
    "description": "Redis is the world's fastest in-memory database",
    "docker_hub_url": "https://hub.docker.com/_/redis",
    "dockerfile_url": "https://github.com/redis/docker-library-redis/blob/master/7.4/alpine/Dockerfile",
    "local_url": null,
    "name": "Redis",
    "url": "https://redis.io"
  },
  {
    "description": "Traefik is your all-in-one, self-hosted, cloud-native, GitOps-driven application proxy, API gateway, and API management platform",
    "docker_hub_url": "https://hub.docker.com/_/traefik",
    "dockerfile_url": "https://github.com/traefik/traefik/blob/master/Dockerfile",
    "local_url": "https://traefik.services.local",
    "name": "Traefik",
    "url": "https://traefik.io/"
  },
  {